{
  "id": "atlas-aml-t0054-llm-jailbreak",
  "name": "MITRE ATLAS LLM Jailbreak",
  "description": "MITRE ATLAS mapping for attempts to bypass model or application safety behavior.",
  "version": "1.0.0",
  "status": "active",
  "tags": ["mitre_atlas", "jailbreak", "policy_bypass"],
  "atlas_id": "AML.T0054",
  "atlas_name": "LLM Jailbreak",
  "mapping_type": "technique",
  "planning_relevance": "Use for policy bypass, refusal consistency, roleplay, gradual escalation, and other safety-boundary evaluations.",
  "related_entities": [
    "obj-jailbreak-resilience",
    "af-jailbreak",
    "af-roleplay"
  ],
  "references": ["ref-mitre-atlas", "ref-microsoft-pyrit", "ref-nvidia-garak"],
  "created_at": "2026-07-08",
  "updated_at": "2026-07-08"
}
